{
  "gitscience": "0.1",
  "kind": "lab",
  "handle": "xiaoli",
  "name": "小李的创客桌",
  "bio": "深圳，做硬件的学生，宿舍改的工作台。",
  "location": { "city": "深圳", "region": "广东", "country": "CN" },
  "availability": {
    "note": "只有周末能用，平时要上课",
    "accepts_samples": false,
    "shipping": "",
    "paid": false
  },
  "capabilities": [
    {
      "id": "dc-measure",
      "what": "直流电压 / 电流测量",
      "gear": ["Fluke 17B+", "可调电源 30V/3A"],
      "limits": ["没有电子负载", "电流只到 3A"],
      "confirmed": true,
      "source": "operator"
    },
    {
      "id": "microscope",
      "what": "小件外观与焊点检查",
      "gear": ["双目显微镜"],
      "limits": ["只能看，没有相机，不能拍照存档"],
      "confirmed": true,
      "source": "operator"
    }
  ],
  "unknowns": ["可调电源的电流显示准不准，没比过"],
  "links": { "contact": "issue" }
}
